B1: PROMO "GO BEIJING 2007 - PAKET LIBURAN KE BEIJING"
B2: PERIODE : 1 APRIL 2007 s/d 30 JUNI 2007
B5: NO. | C5: DIST ID | D5: DIST NAME | E5: PERINGKAT | F5: JUMLAH | G5: PV GROUP | H5: PV GROUP | I5: BERLAKU
F6: REKRUT | H6: (BREAK) | I6: (ORANG)
B7: 1 | C7: ID0000022205 | D7: Ge Ai Ji | E7: Prime Minister | F7: 12 | G7: 157636 | H7: 120000 | I7: 2
B8: =B7+1 -> 2 | C8: ID0000024239 | D8: Muriyani | E8: Ambassador | F8: 10 | G8: 64157 | H8: 60000 | I8: 1
B9: =B8+1 -> 3 | C9: ID0000022299 | D9: Loh Ngow Thoy | E9: Ambassador | F9: 6 | G9: 91118 | H9: 60000 | I9: 0
B10: =B9+1 -> 4 | C10: ID0000022001 | D10: Bambang S Sapoetra | E10: Ambassador | G10: 165496 | H10: =G10-H7 -> 45496 | I10: 0
B11: =B10+1 -> 5 | C11: ID0000022101 | D11: Marcel Wijaya | E11: Ambassador | G11: 159267 | H11: =G11-H7 -> 39267 | I11: 0
B12: =B11+1 -> 6 | C12: ID0000024437 | D12: Ronny Wijaya | E12: Ambassador | F12: 1 | G12: 99885 | H12: 38103 | I12: 0
B13: =B12+1 -> 7 | C13: ID0000022414 | D13: Merryana Gunawan | E13: Ambassador | G13: 97141 | H13: 36131 | I13: 0
B14: =B13+1 -> 8 | C14: ID0000022072 | D14: Heryadi Tjan SH | E14: Ambassador | F14: 4 | G14: 93175 | H14: 32165 | I14: 0
B15: =B14+1 -> 9 | C15: ID0000022547 | D15: Ir.Umar Eddy | E15: Ambassador | F15: 4 | G15: 50216 | H15: 50216 | I15: 0
B16: =B15+1 -> 10 | C16: ID0000024599 | D16: Harry Kolondam | E16: Ambassador | G16: 47252 | H16: 47252 | I16: 0
B17: =B16+1 -> 11 | C17: ID0000025483 | D17: Nelli | E17: Ambassador | F17: 61 | G17: 46223 | H17: 46223 | I17: 0
B18: =B17+1 -> 12 | C18: ID0000024259 | D18: Sholahuddin | E18: Ambassador | F18: 3 | G18: 40466 | H18: 40466 | I18: 0
B19: =B18+1 -> 13 | C19: ID0000024609 | D19: Sufian,SE | E19: Ambassador | F19: 7 | G19: 38451 | H19: 38451 | I19: 0
B20: =B19+1 -> 14 | C20: ID0000027510 | D20: Mainarni | E20: Ambassador | G20: 36224 | H20: 36224 | I20: 0
B21: =B20+1 -> 15 | C21: ID0000022216 | D21: Sri Muljani | E21: Ambassador | F21: 1 | G21: 35593 | H21: 35593 | I21: 0
B22: =B21+1 -> 16 | C22: ID0000027496 | D22: Mok Hock Jeng/Jimmy | E22: Ambassador | G22: 35584 | H22: 35584 | I22: 0
B23: =B22+1 -> 17 | C23: ID0000024923 | D23: Lim Sok gek | E23: Ambassador | G23: 34903 | H23: 34903 | I23: 0
B24: =B23+1 -> 18 | C24: ID0000027478 | D24: Nonny | E24: Ambassador | F24: 3 | G24: 34088 | H24: 34088 | I24: 0
B25: =B24+1 -> 19 | C25: ID0000027764 | D25: Tjia Ngie | E25: Ambassador | F25: 8 | G25: 33573 | H25: 33573 | I25: 0
B26: =B25+1 -> 20 | C26: ID0000024579 | D26: Parini | E26: Titanium | F26: 22 | G26: 32552 | H26: 32552 | I26: 0
B27: =B26+1 -> 21 | C27: ID0000027765 | D27: Bong Cin Fo | E27: Ambassador | F27: 7 | G27: 30022 | H27: 30022 | I27: 0
B28: =B27+1 -> 22 | C28: ID0000027479 | D28: Gay Sek Yong | E28: Titanium | F28: 18 | G28: 28316 | H28: 28316 | I28: 0
B29: =B28+1 -> 23 | C29: ID0000027766 | D29: Yanto | E29: Titanium | F29: 12 | G29: 27117 | H29: 27117 | I29: 0
B30: =B29+1 -> 24 | C30: ID0000022211 | D30: Agus Soegiarto | E30: Ambassador | F30: 9 | G30: 25076 | H30: 25076 | I30: 0
B31: =B30+1 -> 25 | C31: ID0000024110 | D31: Jaenudin | E31: Ambassador | F31: 2 | G31: 24369 | H31: 24369 | I31: 0
B32: =B31+1 -> 26 | C32: ID0000024090 | D32: Tina Yustiana D | E32: Ambassador | F32: 2 | G32: 21150 | H32: 21150 | I32: 0
B33: =B32+1 -> 27 | C33: ID0000022793 | D33: Endang Elisa Helena | E33: Ambassador | G33: 17846 | H33: 17846 | I33: 0
B34: =B33+1 -> 28 | C34: ID0000025021 | D34: Widodo | E34: Platinum | G34: 17531 | H34: 17531 | I34: 0
B35: =B34+1 -> 29 | C35: ID0000027767 | D35: Tjen Janni Als Nana | E35: Platinum | F35: 7 | G35: 16509 | H35: 16509 | I35: 0
B36: =B35+1 -> 30 | C36: ID0000022824 | D36: Nurfida Abadan | E36: Ambassador | G36: 16383 | H36: 16383 | I36: 0
B37: =B36+1 -> 31 | C37: ID0000022796 | D37: Slamet Riyadi | E37: Ambassador | G37: 16180 | H37: 16180 | I37: 0
B38: =B37+1 -> 32 | C38: ID0000022858 | D38: Zhou Xiu Ling | E38: Ambassador | G38: 16062 | H38: 16062 | I38: 0
B39: =B38+1 -> 33 | C39: ID0000027490 | D39: Kim Shia | E39: Platinum | G39: 15712 | H39: 15712 | I39: 0
B40: =B39+1 -> 34 | C40: ID0000022571 | D40: Kusno Hardjadinata S | E40: Ambassador | G40: 15410 | H40: 15410 | I40: 0
B41: =B40+1 -> 35 | C41: ID0000022845 | D41: Dr. Hoetomo | E41: Ambassador | F41: 4 | G41: 15389 | H41: 15389 | I41: 0
B42: =B41+1 -> 36 | C42: ID0000026157 | D42: Sucipto | E42: Platinum | F42: 2 | G42: 15218 | H42: 15218 | I42: 0
B43: =B42+1 -> 37 | C43: ID0000022088 | D43: Leang Gok Oe | E43: Ambassador | F43: 6 | G43: 15208 | H43: 15208 | I43: 0
B44: =B43+1 -> 38 | C44: ID0000027487 | D44: Evanna | E44: Platinum | G44: 14332 | H44: 14332 | I44: 0
B45: =B44+1 -> 39 | C45: ID0000027486 | D45: Sri Wulan Alias Siu Hong | E45: Platinum | G45: 14112 | H45: 14112 | I45: 0
B46: =B45+1 -> 40 | C46: ID0000027491 | D46: Adi Elfi | E46: Platinum | G46: 13868 | H46: 13868 | I46: 0
B47: =B46+1 -> 41 | C47: ID0000027492 | D47: Khoe Pong Dji | E47: Platinum | G47: 13538 | H47: 13538 | I47: 0
B48: =B47+1 -> 42 | C48: ID0000022573 | D48: Fransiska Soegiharto | E48: Ambassador | G48: 13490 | H48: 13490 | I48: 0
B49: =B48+1 -> 43 | C49: ID0000027923 | D49: Sukardi NG | E49: Platinum | G49: 13228 | H49: 13228 | I49: 0
B50: =B49+1 -> 44 | C50: ID0000027763 | D50: Budiman | E50: Platinum | F50: 1 | G50: 12875 | H50: 12875 | I50: 0
B51: =B50+1 -> 45 | C51: ID0000027918 | D51: Jee AW Kim | E51: Platinum | F51: 5 | G51: 12320 | H51: 12320 | I51: 0
B52: =B51+1 -> 46 | C52: ID0000026517 | D52: Tugio | E52: Platinum | G52: 12236 | H52: 12236 | I52: 0
B53: =B52+1 -> 47 | C53: ID0000026519 | D53: Wahyudi Purnomo | E53: Platinum | F53: 8 | G53: 11334 | H53: 11334 | I53: 0
B54: =B53+1 -> 48 | C54: ID0000022999 | D54: Anna Herlina Suherman | E54: Titanium | G54: 10425 | H54: 10425 | I54: 0
B55: =B54+1 -> 49 | C55: ID0000022574 | D55: Hendratno | E55: Ambassador | F55: 1 | G55: 10370 | H55: 10370 | I55: 0
B56: =B55+1 -> 50 | C56: ID0000027916 | D56: Tjioe Wie Sin | E56: Gold | G56: 10126 | H56: 10126 | I56: 0
B57: (Data Updated : 03 July 2007 Jam 18.00 WIB)
B59: Kualifikasi Promo Beijing :
B60: √ | C60: Rekrut 9 New CFO
B61: √ | C61: Jumlah PV Group (Break) dalam Periode Promo, Min 60.000 PV (tidak termasuk 110 PV Pertama), berlaku kelipatan.
B62: √ | C62: Sistem Break Group dan Sisa Pass Up